{
  "artist": "Nicole Belovoskey",
  "entries": [
    {
      "category": null,
      "date": null,
      "featured": false,
      "id": "01JB7Z00000000000000000006",
      "key": null,
      "kind": "collection",
      "links": [],
      "mediums": [],
      "order": null,
      "slug": "music",
      "status": null,
      "summary": "",
      "tags": [],
      "tech": [],
      "title": "Music",
      "why": ""
    }
  ],
  "pipelineVersion": "0.1.0",
  "taxonomy": {
    "categories": [],
    "mediums": [],
    "tags": [],
    "tech": []
  },
  "tracks": [
    {
      "analysis": "https://storage.googleapis.com/canon-public-example/derived/158757cb63bb4daf886e978a5e83705821e62ab6ccf79bc96cdb98bc4492e114/analysis.json",
      "artist": "Nicole Belovoskey",
      "audio": "https://storage.googleapis.com/canon-public-example/derived/5a4a90aa3a166a896ebc69ddbec300317d49c44000917f13c765f7743a9d4d63/first-light.mp3",
      "bpm": 124,
      "camelot": "8A",
      "duration": 214.5,
      "firstBeat": 0.112,
      "id": "01JB7Z00000000000000000007",
      "key": "A minor",
      "slug": "first-light",
      "start": 32,
      "title": "First Light"
    }
  ],
  "view": "holodeck-dj-room",
  "viewVersion": 1
}
